Date,Text,Normalized_Text_NLTK,Normalized_Text_Slang
11/2023,Sejauh ini aku masih suka americanonya fore,sejauh ini aku masih suka americanonya fore,sejauh ini aku masih suka americanonya fore
11/2023,Aku milih kopken dan fore aja deh,aku milih kopken dan fore aja deh,aku milih kopi kenangan dan fore saja deh
11/2023,Matcha frappe nya point coffee SURGA BGT NI MINUMAN,matcha frappe nya point coffee surga bgt ni minuman,matcha frappe nya point coffee surga banget ini minuman
11/2023,Sayang nya 2 point coffee terdekat dari lokasi ku belum join grab. Di Maps pun ga ada Real hidden gem wkwk,sayang nya  point coffee terdekat dari lokasi ku belum join grab di maps pun ga ada real hidden gem wkwk,sayang nya point coffee terdekat dari lokasi ku belum join grab di maps pun tidak ada real hidden gem wkwk
11/2023,"Gak semua di indomaret sosis keju udah ready yaa wkwk , soalnya emg dateng nya gak banyak Sekalinya dateng cuma dalam waktu kurang dr 2 minggu pasti abis apalagi toko nya yang ada klik food atau point coffee",gak semua di indomaret sosis keju udah ready yaa wkwk  soalnya emg dateng nya gak banyak sekalinya dateng cuma dalam waktu kurang dr  minggu pasti abis apalagi toko nya yang ada klik food atau point coffee,gak semua di indomaret sosis keju sudah ready yaa wkwk soalnya memang dateng nya gak banyak sekalinya dateng cuma dalam waktu kurang dr minggu pasti habis apalagi toko nya yang ada klik food atau point coffee
11/2023,Yg palm sugar enak bgtt. Gw ga mau beli kopi merk lain lg selain point coffee,yg palm sugar enak bgtt gw ga mau beli kopi merk lain lg selain point coffee,yang palm gula enak bgtt saya tidak mau beli kopi merk lain lagi selain point coffee
11/2023,Point coffee siihh,point coffee siihh,point coffee siihh
11/2023,bikin coffee sendiri tapi pake tumbler tomoro,bikin coffee sendiri tapi pake tumbler tomoro,bikin coffee sendiri tapi pakai tumbler tomoro
11/2023,Gula Aren Latte nya Fore wajib dicoba,gula aren latte nya fore wajib dicoba,gula aren latte nya fore wajib dicoba
11/2023,"knp ya fore selalu lewat tl pas aku lg gak di Bandung, giliran di bdg lupa buat bli fore",knp ya fore selalu lewat tl pas aku lg gak di bandung giliran di bdg lupa buat bli fore,kenapa iya fore selalu lewat tl pas aku lagi gak di bandung giliran di bandung lupa buat bli fore
11/2023,enakan matcha fore,enakan matcha fore,enakan matcha fore
11/2023,km harus coba matcha tomoro enak bgt,km harus coba matcha tomoro enak bgt,kamu harus coba matcha tomoro enak banget
11/2023,"Jelas matcha kemana mana, nyari matcha terbaik, ada rekomendasi selain Matcha Frappenya Point Coffee yang masih jadi andalan.",jelas matcha kemana mana nyari matcha terbaik ada rekomendasi selain matcha frappenya point coffee yang masih jadi andalan,jelas matcha kemana mana mencari matcha terbaik ada rekomendasi selain matcha frappenya point coffee yang masih jadi andalan
11/2023,"Byee, imo matcha fore agak kureng, dalam artian matchanya kurang kerasa, kurang creamy, dan malah rasanya kaya minuman matcha mau abis tp ditambahin air lagi",byee imo matcha fore agak kureng dalam artian matchanya kurang kerasa kurang creamy dan malah rasanya kaya minuman matcha mau abis tp ditambahin air lagi,byee imo matcha fore agak kureng dalam artian matchanya kurang kerasa kurang creamy dan bahkan rasanya kaya minuman matcha mau habis tapi ditambahin air lagi
11/2023,gue selalu pesennya tomoro oat latte less sugar,gue selalu pesennya tomoro oat latte less sugar,aku selalu pesennya tomoro oat latte kurang gula
11/2023,akuu baru nyoba tomoro nderr dan enakkk,akuu baru nyoba tomoro nderr dan enakkk,akuu baru nyoba tomoro nderr dan enakkk
12/2023,Ini tomoro coffee gaada di semarang kah,ini tomoro coffee gaada di semarang kah,ini tomoro coffee tidak ada uang di semarang kah
12/2023,"fav ak jg matcha oat latte, gada matcha yg seenak tomoro",fav ak jg matcha oat latte gada matcha yg seenak tomoro,favorit saya juga matcha oat latte gada matcha yang seenak tomoro
12/2023,Dari kemarin bersliweran terus ini tomoro jd kepo bgtt dh,dari kemarin bersliweran terus ini tomoro jd kepo bgtt dh,dari kemarin bersliweran terus ini tomoro jadi mau tahu urusan orang bgtt dh
12/2023,"Sejak pertama kali coba, aku langsung jatuh cinta sama Point Coffee.",sejak pertama kali coba aku langsung jatuh cinta sama point coffee,sejak pertama kali coba aku langsung jatuh cinta sama point coffee
12/2023,Adanya fore ajaa,adanya fore ajaa,adanya fore ajaa
12/2023,sejauh ini foreâ€¦,sejauh ini fore,sejauh ini fore
12/2023,"Fore tapi yang chizu:( udah gk produksi yang chizu lagi tapi huft:( Kopken, point coffe sama feel matcha",fore tapi yang chizu udah gk produksi yang chizu lagi tapi huft kopken point coffe sama feel matcha,fore tapi yang chizu sudah gk produksi yang chizu lagi tapi mengeluh kopi kenangan point coffe sama feel matcha
12/2023,sejauh ini point coffee sih kekk auaysgvssyysgs cibta bgttt bgt bgt,sejauh ini point coffee sih kekk auaysgvssyysgs cibta bgttt bgt bgt,sejauh ini point coffee sih kekk auaysgvssyysgs cibta bgttt banget banget
12/2023,knp ya point coffee diket rmhku ttp mehong dan jarang promo? apa itu depends on daerah? pdhl pas ngerantau di jkt bnyk bgt promonya,knp ya point coffee diket rmhku ttp mehong dan jarang promo apa itu depends on daerah pdhl pas ngerantau di jkt bnyk bgt promonya,kenapa iya point coffee diket rmhku ttp mehong dan jarang promo apa itu depends on daerah pdhl pas ngerantau di jakarta banyak banget promonya
12/2023,halte mana iniii enak bgt ada tomoro coffee,halte mana iniii enak bgt ada tomoro coffee,halte mana iniii enak banget ada tomoro coffee
12/2023,rill seenak ituuu aku beli sbgai ganti fore yg chocomint,rill seenak ituuu aku beli sbgai ganti fore yg chocomint,rill seenak ituuu aku beli sbgai ganti fore yang chocomint
12/2023,"Yg maniez2 sering dipesan Kopken: Hazelnut latte (lebih enak yg light, skrg udh discontinued) Janji Jiwa: hitam maniez (dah discontinued) Fore: tiramisu latte/irish latte Animo: kopsus less sugar.. Yg lain blm pernah repeat order kayaknya, kecuali TanaMera di Pancious..",yg maniez sering dipesan kopken hazelnut latte lebih enak yg light skrg udh discontinued janji jiwa hitam maniez dah discontinued fore tiramisu latteirish latte animo kopsus less sugar yg lain blm pernah repeat order kayaknya kecuali tanamera di pancious,yang manis sering dipesan kopi kenangan hazelnut latte lebih enak yang terang sekarang sudah discontinued janji jiwa hitam manis deh discontinued fore tiramisu latteirish latte animo kopsus kurang gula yang lain belum pernah repeat order kayaknya kecuali tanamera di pancious
12/2023,"POV orang Jogja: 1. Homwok (Jujur enak, tapi sering underrated. Paling suka yg original) 2. 26 Coffee 3. Klinik kopi (Coffee addict wajib ke sin) 4. Fore (Suka triple peach americano dan butterscotch sea salt latte) 5. 11/11 Coffee 6. Couvee 7. Janji jiwa",pov orang jogja  homwok jujur enak tapi sering underrated paling suka yg original   coffee  klinik kopi coffee addict wajib ke sin  fore suka triple peach americano dan butterscotch sea salt latte   coffee  couvee  janji jiwa,pov orang jogja homwok jujur enak tapi sering underrated paling suka yang original coffee klinik kopi coffee addict wajib ke sin fore suka triple peach americano dan butterscotch sea salt latte coffee couvee janji jiwa
12/2023,"Kopi kenangan: latte, cappuccino Tuku: kopi susu tetangga Fore: caramel praline macchiato Tomoro: Tomoro oat latte, caffe latte",kopi kenangan latte cappuccino tuku kopi susu tetangga fore caramel praline macchiato tomoro tomoro oat latte caffe latte,kopi kenangan latte cappuccino tuku kopi susu tetangga fore caramel praline macchiato tomoro tomoro oat latte caffe latte
12/2023,krn disini blm ada tuku jd sering ke fore,krn disini blm ada tuku jd sering ke fore,karena disini belum ada tuku jadi sering ke fore
12/2023,"Servisnya bagus banget point coffee, bentuk tanggungjawab",servisnya bagus banget point coffee bentuk tanggungjawab,servisnya bagus banget point coffee bentuk tanggungjawab
12/2023,"Butterscotch apa gitu namanya kalo di Fore, lupa gue",butterscotch apa gitu namanya kalo di fore lupa gue,butterscotch apa gitu namanya kalau di fore lupa aku
12/2023,"Buktiin aja langsung nder, datang ke fore tgl segitu",buktiin aja langsung nder datang ke fore tgl segitu,buktiin saja langsung nder datang ke fore tanggal segitu
12/2023,"di duri bahkan stand nya sampe 2 tuh, satu di atas sebelah kopi kenangan, satu di peron 5",di duri bahkan stand nya sampe  tuh satu di atas sebelah kopi kenangan satu di peron ,di duri bahkan stand nya sampai tuh satu di atas sebelah kopi kenangan satu di peron
12/2023,Rekom menu tomoro coffee yang enak dung,rekom menu tomoro coffee yang enak dung,rekom menu tomoro coffee yang enak dung
12/2023,eh di tomoro yang matcha oatmilk jugaa enak bgttt padahal aku ga terlalu addict ama matcha tapi kalau matcha tomoro aku bisa repeat order kalau kesana,eh di tomoro yang matcha oatmilk jugaa enak bgttt padahal aku ga terlalu addict ama matcha tapi kalau matcha tomoro aku bisa repeat order kalau kesana,eh di tomoro yang matcha oatmilk jugaa enak bgttt padahal aku tidak terlalu addict sama matcha tapi kalau matcha tomoro aku bisa repeat order kalau kesana
12/2023,"Kopken, tomoro kopinya kureng",kopken tomoro kopinya kureng,kopi kenangan tomoro kopinya kureng
12/2023,"kopkenn, kalo mau cari yg promo tomoro",kopkenn kalo mau cari yg promo tomoro,kopkenn kalau mau cari yang promo tomoro
12/2023,"kopken, kalau buat gue tomoro kemanisan",kopken kalau buat gue tomoro kemanisan,kopi kenangan kalau buat aku tomoro kemanisan
12/2023,"Point coffee ini enak, harga jg standar cuma minusnya ga bisa nongkrong, nugas dan wifian. Bisa kaliya point coffee buka cafe kayak fore gitu haha",point coffee ini enak harga jg standar cuma minusnya ga bisa nongkrong nugas dan wifian bisa kaliya point coffee buka cafe kayak fore gitu haha,point coffee ini enak harga juga standar cuma minusnya tidak bisa nongkrong nugas dan wifian bisa kaliya point coffee buka cafe kayak fore gitu tertawa
12/2023,Indomaret yg ada point coffee buka dari jam berapa deh?,indomaret yg ada point coffee buka dari jam berapa deh,indomaret yang ada point coffee buka dari jam berapa deh
12/2023,Jadi ngide mampir dulu sebelum ngantor to make up yang kemarin ketinggalan di mobil temen kenapa gue harus tau ada point coffee yang searah sama jalan ke kantor. Wks tapi besok senen,jadi ngide mampir dulu sebelum ngantor to make up yang kemarin ketinggalan di mobil temen kenapa gue harus tau ada point coffee yang searah sama jalan ke kantor wks tapi besok senen,jadi ngide mampir dulu sebelum ngantor to make up yang kemarin ketinggalan di mobil teman kenapa aku harus tahu ada point coffee yang searah sama jalan ke kantor wks tapi besok senen
12/2023,matcha kopken sama fore emang best bgt,matcha kopken sama fore emang best bgt,matcha kopi kenangan sama fore emang best banget
12/2023,"Baristaa point coffee ku juga kek agak judes gituu , apa aku kepagian yah belinya tapi sebelumku tuh kek udh langganan gitu orangnya dan baristanya ramah poll ke dia",baristaa point coffee ku juga kek agak judes gituu  apa aku kepagian yah belinya tapi sebelumku tuh kek udh langganan gitu orangnya dan baristanya ramah poll ke dia,baristaa point coffee ku juga seperti agak judes gituu apa aku kepagian yah belinya tapi sebelumku tuh seperti sudah langganan gitu orangnya dan baristanya ramah poll ke dia
12/2023,"Makasih bnyak2 sm mbak barista point coffee yg ceria bgtt ngeladenin gw beli dahal mau tutup, mana ada adegan gabisa buka alat whip creamnya tp mbanya masih ceria :')",makasih bnyak sm mbak barista point coffee yg ceria bgtt ngeladenin gw beli dahal mau tutup mana ada adegan gabisa buka alat whip creamnya tp mbanya masih ceria ,terima kasih bnyak sama mbak barista point coffee yang ceria bgtt ngeladenin saya beli dahal mau tutup mana ada adegan gabisa buka alat whip creamnya tapi mbanya masih ceria
12/2023,ooh.. gitu! selama ini aku kalo beli jajan + point coffee tu bayar di kasir terpisah. dan dari kedua pihak kasir ga pernah kasih info bisa begitu,ooh gitu selama ini aku kalo beli jajan  point coffee tu bayar di kasir terpisah dan dari kedua pihak kasir ga pernah kasih info bisa begitu,ooh gitu selama ini aku kalau beli jajan point coffee tu bayar di kasir terpisah dan dari kedua pihak kasir tidak pernah kasih informasi bisa begitu
12/2023,"Matcha d'cost, es krim matcha shabu kojo, sm matchanya fore",matcha dcost es krim matcha shabu kojo sm matchanya fore,matcha dcost es krim matcha shabu kojo sama matchanya fore
12/2023,kok ngeselin gini yaaa??? point coffee di daerah rumahku pada ramah ramah dan baik baik pol,kok ngeselin gini yaaa point coffee di daerah rumahku pada ramah ramah dan baik baik pol,kok ngeselin gini yaaa point coffee di daerah rumahku pada ramah ramah dan baik baik pol
12/2023,"Point coffee mana itu. Aku selama beli point coffee gprnah digtuin kok, pdhal klo milih menu lama bgt tp baristanya ttp ramah.",point coffee mana itu aku selama beli point coffee gprnah digtuin kok pdhal klo milih menu lama bgt tp baristanya ttp ramah,point coffee mana itu aku selama beli point coffee gprnah digtuin kok pdhal kalau milih menu lama banget tapi baristanya ttp ramah
12/2023,"Barista point coffee di tempat gw jg judes bgt, gada ramah2nya samsek trs ga bilang pula kalo gabisa cash pdhl dah selese pesen smpe keluar struk. Giliran gw bilang gada cash ga peduli suruh cari sendiri mana ga dikasi opsi lain ckck",barista point coffee di tempat gw jg judes bgt gada ramahnya samsek trs ga bilang pula kalo gabisa cash pdhl dah selese pesen smpe keluar struk giliran gw bilang gada cash ga peduli suruh cari sendiri mana ga dikasi opsi lain ckck,barista point coffee di tempat saya juga judes banget gada ramahnya sama sekali terus tidak bilang pula kalau gabisa cash pdhl deh selese pesen smpe keluar struk giliran saya bilang gada cash tidak peduli suruh cari sendiri mana tidak dikasi opsi lain ck
12/2023,Fore sih udah paling enak,fore sih udah paling enak,fore sih sudah paling enak
12/2023,"Aneh, padahal memang tiap Senin Point Coffee selalu kasih promo. Mending yang begini ditegur atau dilaporkan biar yang lain dapat rezeki posisi dia. @Indomaret @pointcoffeeid",aneh padahal memang tiap senin point coffee selalu kasih promo mending yang begini ditegur atau dilaporkan biar yang lain dapat rezeki posisi dia  ,aneh padahal memang tiap senin point coffee selalu kasih promo lebih baik yang begini ditegur atau dilaporkan biar yang lain dapat rezeki posisi dia
12/2023,aku dulu pernah ke point coffee juga dan barista nya galak kaya judes... mungkin kecapean ya mbak nya. aku buru buru pesen biar lamgsung pergi,aku dulu pernah ke point coffee juga dan barista nya galak kaya judes mungkin kecapean ya mbak nya aku buru buru pesen biar lamgsung pergi,aku dulu pernah ke point coffee juga dan barista nya galak kaya judes mungkin kecapean iya mbak nya aku buru buru pesen biar lamgsung pergi
12/2023,"Enih fore, biasanya beli nonkopi dan itu pertama kali beli yg kopi TERNYATA BENERAN STRONG KOPINYA, 21 tahun hidup baru kali ini habis minum kopi lambungku bergejolak minum sbuks, kopstud, janjiw, kopken, point coffe, peskop, dan kopi kopian di cafe ga pernah sakit perut",enih fore biasanya beli nonkopi dan itu pertama kali beli yg kopi ternyata beneran strong kopinya  tahun hidup baru kali ini habis minum kopi lambungku bergejolak minum sbuks kopstud janjiw kopken point coffe peskop dan kopi kopian di cafe ga pernah sakit perut,enih fore biasanya beli nonkopi dan itu pertama kali beli yang kopi ternyata beneran strong kopinya tahun hidup baru kali ini habis minum kopi lambungku bergejolak minum sbuks kopstud janjiw kopi kenangan point coffe peskop dan kopi kopian di cafe tidak pernah sakit perut
12/2023,Point coffee menemani perjalanan jkt - bdg,point coffee menemani perjalanan jkt  bdg,point coffee menemani perjalanan jakarta bandung
12/2023,"Disini gaada point coffee pdhl bm dri lama bgt, rasanya pgn gw sendiri aja yg buka cabang disini, tp tabungan gw baru 15rb",disini gaada point coffee pdhl bm dri lama bgt rasanya pgn gw sendiri aja yg buka cabang disini tp tabungan gw baru rb,disini tidak ada uang point coffee pdhl bm dari lama banget rasanya ingin saya sendiri saja yang buka cabang disini tapi tabungan saya baru rb
12/2023,"Eh samaa, barista point coffee deket rumah gue juga gitu, kalo pelanggan mau beli dia pasti selalu kabur2an dah, ngelayanin juga setengah hati dan selalu buru2, kalo pesenannya yang aneh2 pasti bilang ""kosong kak, gak ada"" tapi jutek banget, jadi males mau beli",eh samaa barista point coffee deket rumah gue juga gitu kalo pelanggan mau beli dia pasti selalu kaburan dah ngelayanin juga setengah hati dan selalu buru kalo pesenannya yang aneh pasti bilang kosong kak gak ada tapi jutek banget jadi males mau beli,eh samaa barista point coffee deket rumah aku juga gitu kalau pelanggan mau beli dia pasti selalu kaburan deh ngelayanin juga setengah hati dan selalu buru kalau pesenannya yang aneh pasti bilang kosong kak gak ada tapi galak banget jadi males mau beli
12/2023,next pengen nyobain Matcha Espresso Oatmilk Latte punya Point Coffee,next pengen nyobain matcha espresso oatmilk latte punya point coffee,lanjut pengen nyobain matcha espresso oatmilk latte punya point coffee
12/2023,"kopi saku, kopi baper, matcha aa smua dr point coffee aku sukaa",kopi saku kopi baper matcha aa smua dr point coffee aku sukaa,kopi saku kopi baper matcha aa smua dr point coffee aku sukaa
12/2023,cookies n cream. selama ini tiap ada menu cnc dimanapun pasti rasanya yaudah oke gitu. tapi waktu nyobain punya point coffee kayak â€œbisa ya cookies n cream dibikin enak bgt???â€,cookies n cream selama ini tiap ada menu cnc dimanapun pasti rasanya yaudah oke gitu tapi waktu nyobain punya point coffee kayak bisa ya cookies n cream dibikin enak bgt,cookies dan cream selama ini tiap ada menu cnc dimanapun pasti rasanya ya sudah oke gitu tapi waktu nyobain punya point coffee kayak bisa iya cookies dan cream dibikin enak banget
12/2023,"Pernah pesen di point coffee ada yg baik bgt ditungguin, dijelasin juga rasa kopinya satu2, Tapi ada jg yg macem sender kirim Apakah beda pelatihan karyawan?",pernah pesen di point coffee ada yg baik bgt ditungguin dijelasin juga rasa kopinya satu tapi ada jg yg macem sender kirim apakah beda pelatihan karyawan,pernah pesen di point coffee ada yang baik banget ditungguin dijelasin juga rasa kopinya satu tapi ada juga yang macam sender kirim apakah beda pelatihan karyawan
12/2023,"Lagi suka banget sama Tomoro, apalagi sering bagi bagi kopi gratis + banyak voc diskon. Plus minumannya gak terlalu manis, pokonya enakkk",lagi suka banget sama tomoro apalagi sering bagi bagi kopi gratis  banyak voc diskon plus minumannya gak terlalu manis pokonya enakkk,lagi suka banget sama tomoro apalagi sering bagi bagi kopi gratis banyak voc diskon plus minumannya gak terlalu manis pokonya enakkk
12/2023,"Point coffee tuh manishhhhh banget ga tahannnn padahal dah kinta kurangi gula, kayanya kalo beli harus minta sama sekali gausah pake gula kali ya",point coffee tuh manishhhhh banget ga tahannnn padahal dah kinta kurangi gula kayanya kalo beli harus minta sama sekali gausah pake gula kali ya,point coffee tuh manishhhhh banget tidak tahannnn padahal deh kinta kurangi gula kayaknya kalau beli harus minta sama sekali gausah pakai gula kali iya
12/2023,Fore aku,fore aku,fore aku
12/2023,Ini kopi kenangan mantan favorit bgt,ini kopi kenangan mantan favorit bgt,ini kopi kenangan mantan favorit banget
12/2023,"Gimana anak umur 3thun,4thun sering dibeliin segala macam rupa minuman kekinian kek Boba lah, hampir tiap hari udh tauan chatime,Tomoro lah, no coffee pokoknya. Manis semua itu",gimana anak umur thunthun sering dibeliin segala macam rupa minuman kekinian kek boba lah hampir tiap hari udh tauan chatimetomoro lah no coffee pokoknya manis semua itu,bagaimana anak umur thunthun sering dibeliin segala macam rupa minuman kekinian seperti boba lah hampir tiap hari sudah tauan chatimetomoro lah no coffee pokoknya manis semua itu
12/2023,Point coffee andalanku tiap senin,point coffee andalanku tiap senin,point coffee andalanku tiap senin
12/2023,Masih belum bisa terima bilang frappe dikoreksi jadi frep di Point Coffee stasiun Purwokerto,masih belum bisa terima bilang frappe dikoreksi jadi frep di point coffee stasiun purwokerto,masih belum bisa terima bilang frappe dikoreksi jadi frep di point coffee stasiun purwokerto
12/2023,"Holycow, sushi tei, nannys pavilon, ichiban sushi, tawan, pepper lunch, sbux cake(kalo punya reward), boost, fore",holycow sushi tei nannys pavilon ichiban sushi tawan pepper lunch sbux cakekalo punya reward boost fore,holycow sushi tei nannys pavilon ichiban sushi tawan pepper lunch starbucks cakekalo punya reward boost fore
12/2023,"Fore enak, ga terlalu strong kopinya",fore enak ga terlalu strong kopinya,fore enak tidak terlalu strong kopinya
12/2023,"Dua enih, iya aku sapi doyan rumput. Bodo amat pokoknya matcha enak semua di tomoro. Tpppp kalo matcha yg susunya diganti oatmilk aku kurang suka sumpah rasanya kek minumbnori",dua enih iya aku sapi doyan rumput bodo amat pokoknya matcha enak semua di tomoro tpppp kalo matcha yg susunya diganti oatmilk aku kurang suka sumpah rasanya kek minumbnori,dua enih iya aku sapi doyan rumput bodo amat pokoknya matcha enak semua di tomoro tpppp kalau matcha yang susunya diganti oatmilk aku kurang suka sumpah rasanya seperti minumbnori
12/2023,"kl doyan rumput2an matcha/hojicha oat latte kopinya baru coba manuka oat latte, kata masnya td si madu+espresso+oat tp gk bikin pusing/mual, aman di perutku yg kadang perih wkwkwkwkwk dan kadar gula tomoro sgt diabetesable, gk req pun aman",kl doyan rumputan matchahojicha oat latte kopinya baru coba manuka oat latte kata masnya td si maduespressooat tp gk bikin pusingmual aman di perutku yg kadang perih wkwkwkwkwk dan kadar gula tomoro sgt diabetesable gk req pun aman,kalau doyan rumputan matchahojicha oat latte kopinya baru coba manuka oat latte kata masnya tadi si maduespressooat tapi gk bikin pusingmual aman di perutku yang kadang perih wkwkwkwkwk dan kadar gula tomoro sangat diabetesable gk req pun aman
12/2023,Pengen banget kromboloni ini tapi tidak kunjung ku eksekusi. Malah ngeksekusi point coffee promo i do like monday mistery troos,pengen banget kromboloni ini tapi tidak kunjung ku eksekusi malah ngeksekusi point coffee promo i do like monday mistery troos,pengen banget kromboloni ini tapi tidak kunjung ku eksekusi bahkan ngeksekusi point coffee promo i do like monday mistery troos
12/2023,FYI KALO KALIAN LEWAT TOL JAKARTA-MERAK KM 43 itu ada mereka jual di @Indomaret point caffee gedhe baru buka,fyi kalo kalian lewat tol jakartamerak km  itu ada mereka jual di  point caffee gedhe baru buka,sebagai informasi kalau kalian lewat tol jakartamerak kamu itu ada mereka jual di point caffee gedhe baru buka
12/2023,"ih sumpah matcha tomoro gaenak anj , enakan point valid , tp gua ttp gsuka matcha",ih sumpah matcha tomoro gaenak anj  enakan point valid  tp gua ttp gsuka matcha,ih sumpah matcha tomoro gaenak anj enakan point valid tapi saya ttp gsuka matcha
12/2023,"Menu fore kids nder atau matcha Kl kopi tp gak mau terlalu strong ada Light buttercream latte. Dia kopinya cuma di cream,base minumannya susu Yg choco mint aku gk terlalu suka. Kentel banget coklatnya Fav aku sih kopi yg tiramisu latte,trs bisa minta less kopi/espresso",menu fore kids nder atau matcha kl kopi tp gak mau terlalu strong ada light buttercream latte dia kopinya cuma di creambase minumannya susu yg choco mint aku gk terlalu suka kentel banget coklatnya fav aku sih kopi yg tiramisu lattetrs bisa minta less kopiespresso,menu fore kids nder atau matcha kalau kopi tapi gak mau terlalu strong ada terang buttercream latte dia kopinya cuma di creambase minumannya susu yang choco mint aku gk terlalu suka kentel banget coklatnya favorit aku sih kopi yang tiramisu lattetrs bisa minta kurang kopiespresso
12/2023,aku kalo beli point coffee order yang no sugar,aku kalo beli point coffee order yang no sugar,aku kalau beli point coffee order yang no gula
12/2023,Point coffee besok ada promo monday mystery ga ya?,point coffee besok ada promo monday mystery ga ya,point coffee besok ada promo monday mystery tidak iya
12/2023,kalo beli point coffee emang harus less sugar walaupun lu sweet tooth,kalo beli point coffee emang harus less sugar walaupun lu sweet tooth,kalau beli point coffee emang harus kurang gula walaupun kamu sweet tooth
12/2023,"Coba ke sbux atau point coffee, mereka ada decaf",coba ke sbux atau point coffee mereka ada decaf,coba ke starbucks atau point coffee mereka ada decaf
12/2023,Minusnya point coffee kalau udah cair rasanya tinggal gula arennya doang saking banyaknya,minusnya point coffee kalau udah cair rasanya tinggal gula arennya doang saking banyaknya,minusnya point coffee kalau sudah cair rasanya tinggal gula arennya doang saking banyaknya
12/2023,"Selalu minta less sugar, nder. Takaran point coffee sekitaran 10-15ml soalnya..",selalu minta less sugar nder takaran point coffee sekitaran ml soalnya,selalu minta kurang gula nder takaran point coffee sekitaran ml soalnya
12/2023,"Less sugar point coffee masih manis, tapi jadinya malah pas gitu rasanya dibanding normal sugar yang always kemanisan.",less sugar point coffee masih manis tapi jadinya malah pas gitu rasanya dibanding normal sugar yang always kemanisan,kurang gula point coffee masih manis tapi jadinya bahkan pas gitu rasanya dibanding normal gula yang always kemanisan
12/2023,knp fore gaada di domku siihh,knp fore gaada di domku siihh,kenapa fore tidak ada uang di domku siihh
12/2023,@fidzaaja juga sekali beli 3 cup beda rasa. Mau riview fore kayanya. Tp dia beli sendiri, juga sekali beli  cup beda rasa mau riview fore kayanya tp dia beli sendiri,juga sekali beli cup beda rasa mau riview fore kayaknya tapi dia beli sendiri
