Date,Text,Normalized_Text_NLTK,Normalized_Text_Slang
07/2023,Fore dihati,fore dihati,fore dihati
07/2023,"Biasa pesen latte no sugar, menu terenak di fore menurutku itu double shaken latte!",biasa pesen latte no sugar menu terenak di fore menurutku itu double shaken latte,biasa pesen latte no gula menu terenak di fore menurutku itu double shaken latte
07/2023,Aku tim point coffee,aku tim point coffee,aku tim point coffee
07/2023,"Masih banyak sih, tapi rata-rata fore",masih banyak sih tapi ratarata fore,masih banyak sih tapi ratarata fore
07/2023,yg terakhir dalgona berkedok fore,yg terakhir dalgona berkedok fore,yang terakhir dalgona berkedok fore
07/2023,Coffee fav Ice blackcoffee - kopi kenangan (enak&murah) Hot Cappucino - Sushi Tei Cafe (enak banget),coffee fav ice blackcoffee  kopi kenangan enakmurah hot cappucino  sushi tei cafe enak banget,coffee favorit ice blackcoffee kopi kenangan enakmurah hot cappucino sushi tei cafe enak banget
07/2023,"Setuju Aku abis nyoba point coffee, malemnya ga bisa tidur. Alhasil melek sampe pagi",setuju aku abis nyoba point coffee malemnya ga bisa tidur alhasil melek sampe pagi,setuju aku habis nyoba point coffee malemnya tidak bisa tidur alhasil melek sampai pagi
07/2023,"Aku sukaaa 8/10 lah, dan sekarang pengen nyempetin coba matchanya fore",aku sukaaa  lah dan sekarang pengen nyempetin coba matchanya fore,aku sukaaa lah dan sekarang pengen nyempetin coba matchanya fore
07/2023,"Imo, sangat amat b aja untuk harga segitu apa mungkin gue salah mesen menu kali ya harusnya dpt yg enakan si. Tp kaum mensang mending macem ak, mendingan jajan fore kemana2 heu",imo sangat amat b aja untuk harga segitu apa mungkin gue salah mesen menu kali ya harusnya dpt yg enakan si tp kaum mensang mending macem ak mendingan jajan fore kemana heu,imo sangat amat b saja untuk harga segitu apa mungkin aku salah mesen menu kali iya harusnya dapat yang enakan si tapi kaum mensang lebih baik macam saya mendingan jajan fore kemana heu
07/2023,Same heree Point coffee ternyata enakk,same heree point coffee ternyata enakk,same heree point coffee ternyata enakk
07/2023,ini point coffee yg rasa apa nder?,ini point coffee yg rasa apa nder,ini point coffee yang rasa apa nder
07/2023,Sama point coffee jugaa tapi ini kopi saku wkwk,sama point coffee jugaa tapi ini kopi saku wkwk,sama point coffee jugaa tapi ini kopi saku wkwk
07/2023,Enak banget caramel machiato nya point coffee,enak banget caramel machiato nya point coffee,enak banget caramel machiato nya point coffee
07/2023,Buset 27 rebu mending point coffee langsung nder lebih enak :'),buset  rebu mending point coffee langsung nder lebih enak ,buset rebu lebih baik point coffee langsung nder lebih enak
07/2023,"abis gofood fore. finally ga classic latte lagi wkwk masa tiap beli kopi di fore classic latte mulu, keluar dr zona nyaman nyobain buterscotch sea salt latte kiww ternyata enakkk.",abis gofood fore finally ga classic latte lagi wkwk masa tiap beli kopi di fore classic latte mulu keluar dr zona nyaman nyobain buterscotch sea salt latte kiww ternyata enakkk,habis gofood fore finally tidak classic latte lagi wkwk masa tiap beli kopi di fore classic latte melulu keluar dr zona nyaman nyobain buterscotch sea salt latte kiww ternyata enakkk
07/2023,"gue juga lagi. baper sama masÂ² tomoro coffe. saking seringnya nugas disana, sampe dikenal padahal saat itu gue lagi gk pake kerudung krn take away",gue juga lagi baper sama mas tomoro coffe saking seringnya nugas disana sampe dikenal padahal saat itu gue lagi gk pake kerudung krn take away,aku juga lagi baper sama mas tomoro coffe saking seringnya nugas disana sampai dikenal padahal saat itu aku lagi gk pakai kerudung karena take away
07/2023,Pandan latte sih kalau fore mah,pandan latte sih kalau fore mah,pandan latte sih kalau fore mah
07/2023,gak akan bosen menyarankan butterscotch sea salt latte nya fore juaraaakkkk,gak akan bosen menyarankan butterscotch sea salt latte nya fore juaraaakkkk,gak akan bosen menyarankan butterscotch sea salt latte nya fore juaraaakkkk
07/2023,"Pandan latte Butterscotch sea salt latte Aren latte Gw ga terlalu suka kopi, tapi kalo 3 menu fore ini sih naisss",pandan latte butterscotch sea salt latte aren latte gw ga terlalu suka kopi tapi kalo  menu fore ini sih naisss,pandan latte butterscotch sea salt latte aren latte saya tidak terlalu suka kopi tapi kalau menu fore ini sih naisss
07/2023,Kenapa fore sangattt lama penyajiannya,kenapa fore sangattt lama penyajiannya,kenapa fore sangattt lama penyajiannya
07/2023,fore semua enakk,fore semua enakk,fore semua enakk
07/2023,kapan ya fore ada di mdn :),kapan ya fore ada di mdn ,kapan iya fore ada di mdn
07/2023,"Aku gatau sih nder cmn americano yg cocok di aku ada di fore menunya tu manuka americano dia menurut aku sih sangat ringan dan aga manis karna pake honey sedikit jd ga strong bgt kaya americano biasanya, pernah jg coba americano sbucks tp terlalu strong bagi aku yg lemah wkwk",aku gatau sih nder cmn americano yg cocok di aku ada di fore menunya tu manuka americano dia menurut aku sih sangat ringan dan aga manis karna pake honey sedikit jd ga strong bgt kaya americano biasanya pernah jg coba americano sbucks tp terlalu strong bagi aku yg lemah wkwk,aku gatau sih nder cmn americano yang cocok di aku ada di fore menunya tu manuka americano dia menurut aku sih sangat ringan dan aga manis karena pakai honey sedikit jadi tidak strong banget kaya americano biasanya pernah juga coba americano sbucks tapi terlalu strong bagi aku yang lemah wkwk
07/2023,"Sama aja, doiku bukan yang tiap hari minum americano disana tapi pas di indo nyobain americano fore juga rasanya sama. Di sbux juga sama aja rasanya",sama aja doiku bukan yang tiap hari minum americano disana tapi pas di indo nyobain americano fore juga rasanya sama di sbux juga sama aja rasanya,sama saja doiku bukan yang tiap hari minum americano disana tapi pas di indo nyobain americano fore juga rasanya sama di starbucks juga sama saja rasanya
07/2023,Kopi kenangan Setuju?? Like tweet gw wkwk,kopi kenangan setuju like tweet gw wkwk,kopi kenangan setuju like tweet saya wkwk
07/2023,Keknya terakhir beberapa bulan lalu ke fore,keknya terakhir beberapa bulan lalu ke fore,kayaknya terakhir beberapa bulan lalu ke fore
07/2023,"Gaji 2 juta, tapi bisa minum starbucks, coffee bean, djournal, kopi kenangan dan kalau makan, bisa makanan jepang dan korea itu gratis jadi gaji gak pernah kesentuh buat makan dan minum.",gaji  juta tapi bisa minum starbucks coffee bean djournal kopi kenangan dan kalau makan bisa makanan jepang dan korea itu gratis jadi gaji gak pernah kesentuh buat makan dan minum,gaji juta tapi bisa minum starbucks coffee bean djournal kopi kenangan dan kalau makan bisa makanan jepang dan korea itu gratis jadi gaji gak pernah kesentuh buat makan dan minum
07/2023,Aku senengnya point coffee aja enak nder mana murah lg,aku senengnya point coffee aja enak nder mana murah lg,aku senengnya point coffee saja enak nder mana murah lagi
07/2023,"Gatau, gua juga heran punya temen tiap hari minum point kopi dan kopi kenangan. Beneran tiap malam",gatau gua juga heran punya temen tiap hari minum point kopi dan kopi kenangan beneran tiap malam,gatau saya juga heran punya teman tiap hari minum point kopi dan kopi kenangan beneran tiap malam
07/2023,"sbux si, punya fore jg enak",sbux si punya fore jg enak,starbucks si punya fore juga enak
07/2023,"Kekopian di point coffee Indoapril selain enak, juga cukup strong.",kekopian di point coffee indoapril selain enak juga cukup strong,kekopian di point coffee indoapril selain enak juga cukup strong
07/2023,"Sbux, point coffee menurutku kurang",sbux point coffee menurutku kurang,starbucks point coffee menurutku kurang
07/2023,Point coffee mayan enak matcha nya,point coffee mayan enak matcha nya,point coffee mayan enak matcha nya
07/2023,Punyanya Tomoro enak nder,punyanya tomoro enak nder,punyanya tomoro enak nder
07/2023,Aku suka tomoro,aku suka tomoro,aku suka tomoro
07/2023,"point coffee, kebetulan senin besok promonya yg matcha",point coffee kebetulan senin besok promonya yg matcha,point coffee kebetulan senin besok promonya yang matcha
07/2023,"ini yang aku tau kalo daerah jkt - kopi konnichiwa - tomoro coffee - matcha bae - feel matcha kalo beneran mau minum matcha, bukan matcha yang dominan susu",ini yang aku tau kalo daerah jkt  kopi konnichiwa  tomoro coffee  matcha bae  feel matcha kalo beneran mau minum matcha bukan matcha yang dominan susu,ini yang aku tahu kalau daerah jakarta kopi konnichiwa tomoro coffee matcha bae feel matcha kalau beneran mau minum matcha bukan matcha yang dominan susu
07/2023,"Aku pengen banget ke point coffee, tapi gak lewat situ mulu",aku pengen banget ke point coffee tapi gak lewat situ mulu,aku pengen banget ke point coffee tapi gak lewat situ melulu
07/2023,"Hah serius promoan hari ini? Baru jg ngejar promo tomoro, jd bingung",hah serius promoan hari ini baru jg ngejar promo tomoro jd bingung,hah serius promoan hari ini baru juga ngejar promo tomoro jadi bingung
07/2023,Point coffee klo lgi pngn kopi biasanya aku campur kaya ginii,point coffee klo lgi pngn kopi biasanya aku campur kaya ginii,point coffee kalau lagi pngn kopi biasanya aku campur kaya begini
07/2023,Kalo point coffee varian frappe mending no sugar aja nder karena emang semanis itu manisnya bs didapet dr whip cream dan syrup nya.,kalo point coffee varian frappe mending no sugar aja nder karena emang semanis itu manisnya bs didapet dr whip cream dan syrup nya,kalau point coffee varian frappe lebih baik no gula saja nder karena emang semanis itu manisnya bisa didapet dr whip cream dan syrup nya
07/2023,Info kalideres IDM Point Coffee ada ga siii?,info kalideres idm point coffee ada ga siii,informasi kalideres idm point coffee ada tidak siii
07/2023,pengennn tapi disini gada point coffee,pengennn tapi disini gada point coffee,pengennn tapi disini gada point coffee
07/2023,Lu beli matcha point coffee nder skrng mumpung lg disc,lu beli matcha point coffee nder skrng mumpung lg disc,kamu beli matcha point coffee nder skrng selagi lagi diskon
07/2023,Kopi kenangan skrg jual sprite kah?,kopi kenangan skrg jual sprite kah,kopi kenangan sekarang jual sprite kah
07/2023,aku tipikal klo ke coffe shop cari yang pelayanan nya ramah sejauh ini starbucks sm fore paling best best,aku tipikal klo ke coffe shop cari yang pelayanan nya ramah sejauh ini starbucks sm fore paling best best,aku tipikal kalau ke coffe shop cari yang pelayanan nya ramah sejauh ini starbucks sama fore paling best best
07/2023,"Sbux sama fore itu menurutku baiiiiik dan helpful bgt. Aku pertama kali ke fore dgn baju lusuh bawa barang banyak krn mau ke stasiun, tp baristanya tetep ngejelasin dgn sabar dan detil gitu. Mana ga judes samsek, malah ramah",sbux sama fore itu menurutku baiiiiik dan helpful bgt aku pertama kali ke fore dgn baju lusuh bawa barang banyak krn mau ke stasiun tp baristanya tetep ngejelasin dgn sabar dan detil gitu mana ga judes samsek malah ramah,starbucks sama fore itu menurutku baiiiiik dan helpful banget aku pertama kali ke fore dengan baju lusuh bawa barang banyak karena mau ke stasiun tapi baristanya tetep ngejelasin dengan sabar dan detil gitu mana tidak judes sama sekali bahkan ramah
07/2023,Pliss drpd sbux gua lebih suka fore coffe apalagi yg hazelnut,pliss drpd sbux gua lebih suka fore coffe apalagi yg hazelnut,tolonglah daripada starbucks saya lebih suka fore coffe apalagi yang hazelnut
07/2023,"Aku kalo lagi punya uang beli Starbucks. Klo gak punya budget ya Kopi kenangan, Fore atau Flash. Tapi gak bilang Starbuck mahal karena semua rasanya memang worthed. Sudah pernah juga ngopi2 di Hotel yg lebih mahal dari Starbucks. Tapi gak tiap hari juga. Sesimple itu.",aku kalo lagi punya uang beli starbucks klo gak punya budget ya kopi kenangan fore atau flash tapi gak bilang starbuck mahal karena semua rasanya memang worthed sudah pernah juga ngopi di hotel yg lebih mahal dari starbucks tapi gak tiap hari juga sesimple itu,aku kalau lagi punya uang beli starbucks kalau gak punya budget iya kopi kenangan fore atau flash tapi gak bilang starbuck mahal karena semua rasanya memang worthed sudah pernah juga ngopi di hotel yang lebih mahal dari starbucks tapi gak tiap hari juga sesimple itu
07/2023,"Aku kalo lagi punya uang beli Starbucks. Klo gak punya budget ya Kopi kenangan, Fore atau Flash. Tapi gak bilang Starbuck mahal karena semua rasanya memang worthed. Sudah pernah juga ngopi2 di Hotel yg lebih mahal dari Starbucks. Tapi gak tiap hari juga. Sesimple itu.",aku kalo lagi punya uang beli starbucks klo gak punya budget ya kopi kenangan fore atau flash tapi gak bilang starbuck mahal karena semua rasanya memang worthed sudah pernah juga ngopi di hotel yg lebih mahal dari starbucks tapi gak tiap hari juga sesimple itu,aku kalau lagi punya uang beli starbucks kalau gak punya budget iya kopi kenangan fore atau flash tapi gak bilang starbuck mahal karena semua rasanya memang worthed sudah pernah juga ngopi di hotel yang lebih mahal dari starbucks tapi gak tiap hari juga sesimple itu
07/2023,Semenjak ada Point coffee jadi udh lama banget ga beli chatime udah lupa rasa,semenjak ada point coffee jadi udh lama banget ga beli chatime udah lupa rasa,semenjak ada point coffee jadi sudah lama banget tidak beli chatime sudah lupa rasa
08/2023,"Nyoba fore, tp tetep suka kopi kenangan",nyoba fore tp tetep suka kopi kenangan,nyoba fore tapi tetep suka kopi kenangan
08/2023,"Juaranya kopi ya cuma FORE, no debat no kecot",juaranya kopi ya cuma fore no debat no kecot,juaranya kopi iya cuma fore no debat no kecot
08/2023,"Padahal ada point coffee bisa minta americano on the rock apa doppio on the rock, add on susu pisang masih masuk lah. Kalau nescafe item yg kalengan ini dah manis soalnya",padahal ada point coffee bisa minta americano on the rock apa doppio on the rock add on susu pisang masih masuk lah kalau nescafe item yg kalengan ini dah manis soalnya,padahal ada point coffee bisa minta americano on the rock apa doppio on the rock add on susu pisang masih masuk lah kalau nescafe hitam yang kalengan ini deh manis soalnya
08/2023,"Ini tolong bgt ya udh gak bisa beli es batu nya di point coffee, jgn diikutin plis.",ini tolong bgt ya udh gak bisa beli es batu nya di point coffee jgn diikutin plis,ini tolong banget iya sudah gak bisa beli es batu nya di point coffee jangan diikutin plis
08/2023,"engga soalnya minuman kemasan gulanya tinggi apalagi gabungin dua minuman gini. kalau aku mungkin bakal beli point coffee aja udah. caffe latte no sugar, gak ribet. harganya juga kayaknya sama aja karna setauku nescafe kaleng 10 an, es batu 3k, susu pisang mujigae 10 an",engga soalnya minuman kemasan gulanya tinggi apalagi gabungin dua minuman gini kalau aku mungkin bakal beli point coffee aja udah caffe latte no sugar gak ribet harganya juga kayaknya sama aja karna setauku nescafe kaleng  an es batu k susu pisang mujigae  an,engga soalnya minuman kemasan gulanya tinggi apalagi gabungin dua minuman gini kalau aku mungkin bakal beli point coffee saja sudah caffe latte no gula gak ribet harganya juga kayaknya sama saja karena setauku nescafe kaleng an es batu ke susu pisang mujigae an
08/2023,Ada point coffee malah beli kopi kaleng?,ada point coffee malah beli kopi kaleng,ada point coffee bahkan beli kopi kaleng
08/2023,"Semua akan kopi pada waktunya wkwk. Aku juga kalo gak batesin, bisa sehari 2x ngopi. Sekarang seminggu 2-3x aja. Btw, selain fore, kopken emang enak sih menurutku.",semua akan kopi pada waktunya wkwk aku juga kalo gak batesin bisa sehari x ngopi sekarang seminggu x aja btw selain fore kopken emang enak sih menurutku,semua akan kopi pada waktunya wkwk aku juga kalau gak batesin bisa sehari x ngopi sekarang seminggu x saja ngomong-ngomong selain fore kopi kenangan emang enak sih menurutku
08/2023,"MENCHI KATSU SM POINT COFFEE YANG MYSTERIOUS GREEN. Trus sosis keju, dimsum ayam jamur atau bayem (?), Chicken nanban sandwich, boneless chicken, roti yg cheese boat (?), Apple pie, onigiri tuna mayo, pizza yg pepperoni",menchi katsu sm point coffee yang mysterious green trus sosis keju dimsum ayam jamur atau bayem  chicken nanban sandwich boneless chicken roti yg cheese boat  apple pie onigiri tuna mayo pizza yg pepperoni,menchi katsu sama point coffee yang mysterious green terus sosis keju dimsum ayam jamur atau bayem chicken nanban sandwich boneless chicken roti yang cheese boat apple pie onigiri tuna mayo pizza yang pepperoni
08/2023,"aku suka dimsumnya, point coffee",aku suka dimsumnya point coffee,aku suka dimsumnya point coffee
08/2023,"Pngen bgt fore, di Cikarang blm ada keknya",pngen bgt fore di cikarang blm ada keknya,pngen banget fore di cikarang belum ada kayaknya
08/2023,Di tempatku gada fore,di tempatku gada fore,di tempatku gada fore
08/2023,"msh blm nemu, perkopiannya fore tuh rasa kopinya kencengg bgt dah susah diterima utk aku yg gasuka sm kopi yg strong gt huh",msh blm nemu perkopiannya fore tuh rasa kopinya kencengg bgt dah susah diterima utk aku yg gasuka sm kopi yg strong gt huh,masih belum nemu perkopiannya fore tuh rasa kopinya kencengg banget deh susah diterima untuk aku yang gasuka sama kopi yang strong begitu huh
08/2023,"Banana butterscotch latte dulu paling fav, pandan latte ekstra creamcheese juga enak, gue dlu mantan barista fore jd smp skrg masi bisa tu bikin aren latte, praline macchiato dl",banana butterscotch latte dulu paling fav pandan latte ekstra creamcheese juga enak gue dlu mantan barista fore jd smp skrg masi bisa tu bikin aren latte praline macchiato dl,banana butterscotch latte dulu paling favorit pandan latte ekstra creamcheese juga enak aku dulu mantan barista fore jadi smp sekarang masi bisa tu bikin aren latte praline macchiato dl
08/2023,"Aku pernah jam 9 malem masih nangkring di indomaret sambil nyruput point coffee. Trs ada roti fresh from oven mereka tawarin ke semua yg masih ada di indomaret pas itu, aku beli yg double cheese tuh 9k, aslinya 10k. Selain itu kurang tau sih promonya pas kapan aja",aku pernah jam  malem masih nangkring di indomaret sambil nyruput point coffee trs ada roti fresh from oven mereka tawarin ke semua yg masih ada di indomaret pas itu aku beli yg double cheese tuh k aslinya k selain itu kurang tau sih promonya pas kapan aja,aku pernah jam malam masih nangkring di indomaret sambil nyruput point coffee terus ada roti fresh from oven mereka tawarin ke semua yang masih ada di indomaret pas itu aku beli yang double cheese tuh ke aslinya ke selain itu kurang tahu sih promonya pas kapan saja
08/2023,Promo an point coffee senin kmrn,promo an point coffee senin kmrn,promo an point coffee senin kemarin
08/2023,"point coffee, coklat thunder, campina krezz, chitato sapi panggang, wallens coklat, garuda ocorn, ghost paper, kanzler, chiki ball ayam",point coffee coklat thunder campina krezz chitato sapi panggang wallens coklat garuda ocorn ghost paper kanzler chiki ball ayam,point coffee coklat thunder campina krezz chitato sapi panggang wallens coklat garuda ocorn ghost paper kanzler chiki ball ayam
08/2023,kalo diliat dari gelas minumannya mirip point coffee TP GATAU SPILL LAH MAU JG,kalo diliat dari gelas minumannya mirip point coffee tp gatau spill lah mau jg,kalau diliat dari gelas minumannya mirip point coffee tapi gatau spill lah mau juga
08/2023,kamu beli di mana ? itu gelas point coffee bukan ?,kamu beli di mana  itu gelas point coffee bukan ,kamu beli di mana itu gelas point coffee bukan
08/2023,gelasnya point coffee tapi lo beli croissant nya dmn anjir???? spill,gelasnya point coffee tapi lo beli croissant nya dmn anjir spill,gelasnya point coffee tapi kamu beli croissant nya dimana anjing spill
08/2023,"Kmrn takeaway point coffee di domar. Udh bayar dan disuruh tunggu dulu sm baristanya tp ga fokus malah jalan keluar, dikejar sm mba staf lain karna pesenannya beloman",kmrn takeaway point coffee di domar udh bayar dan disuruh tunggu dulu sm baristanya tp ga fokus malah jalan keluar dikejar sm mba staf lain karna pesenannya beloman,kemarin takeaway point coffee di domar sudah bayar dan disuruh tunggu dulu sama baristanya tapi tidak fokus bahkan jalan keluar dikejar sama mbak staf lain karena pesenannya beloman
08/2023,Gue suka tomoro aaaakh kangen tomoro ada di sebelah kampus alias KANGEN KE KAMPUS,gue suka tomoro aaaakh kangen tomoro ada di sebelah kampus alias kangen ke kampus,aku suka tomoro aaaakh kangen tomoro ada di sebelah kampus alias kangen ke kampus
08/2023,"Aku suka tomoro, tapi es coklatnya menurutku lebih kayak es milo",aku suka tomoro tapi es coklatnya menurutku lebih kayak es milo,aku suka tomoro tapi es coklatnya menurutku lebih kayak es milo
09/2023,menu barunya fore recommend bgt 10/10,menu barunya fore recommend bgt ,menu barunya fore recommend banget
09/2023,Kopi kenangan di aplikasi,kopi kenangan di aplikasi,kopi kenangan di aplikasi
09/2023,Fore tidak pernah mengecewakan pokoknyaaa,fore tidak pernah mengecewakan pokoknyaaa,fore tidak pernah mengecewakan pokoknyaaa
09/2023,matcha espresso by kopi kenangan,matcha espresso by kopi kenangan,matcha espresso oleh kopi kenangan
09/2023,matchanya kopi kenangan,matchanya kopi kenangan,matchanya kopi kenangan
09/2023,"aku juga pernah nder lagi dinas luar kota kan trus ke point coffee dan baru inget di depan indomart kalo aku ga bawa dompet dan bawa hp yg susah sinyal, alhasil aku minta tetring ke barista nya dan boleh eh ternyata di point gada paper bag alhasil aku harus beli jajan biar",aku juga pernah nder lagi dinas luar kota kan trus ke point coffee dan baru inget di depan indomart kalo aku ga bawa dompet dan bawa hp yg susah sinyal alhasil aku minta tetring ke barista nya dan boleh eh ternyata di point gada paper bag alhasil aku harus beli jajan biar,aku juga pernah nder lagi dinas luar kota kan terus ke point coffee dan baru inget di depan indomart kalau aku tidak bawa dompet dan bawa hp yang susah sinyal alhasil aku minta tetring ke barista nya dan boleh eh ternyata di point gada paper bag alhasil aku harus beli jajan biar
09/2023,Sebulan kmrin bner2 gila matcha lattenya tomoro smp tiap minggu pasti absen,sebulan kmrin bner gila matcha lattenya tomoro smp tiap minggu pasti absen,sebulan kmrin bner gila matcha lattenya tomoro smp tiap minggu pasti absen
09/2023,@ristiiiningtyas yasss liat thread ini kalo mau rekomen fore coffee, yasss liat thread ini kalo mau rekomen fore coffee,yasss lihat thread ini kalau mau rekomen fore coffee
09/2023,"Coba yg matcha latte nya... tp b aja, masih lebih suka yg point coffee :D",coba yg matcha latte nya tp b aja masih lebih suka yg point coffee d,coba yang matcha latte nya tapi b saja masih lebih suka yang point coffee di
09/2023,aku ga pernah beli matcha latte/freeze nya siee tp MATCHA ESPRESSO KOPI KENANGAN ENAK BANGETT SUMPIL,aku ga pernah beli matcha lattefreeze nya siee tp matcha espresso kopi kenangan enak bangett sumpil,aku tidak pernah beli matcha lattefreeze nya siee tapi matcha espresso kopi kenangan enak bangett sumpil
09/2023,ih mau coba matcha kopi kenangan ah,ih mau coba matcha kopi kenangan ah,ih mau coba matcha kopi kenangan ah
09/2023,"Di kediri point coffee nya tutup gegara idm nya direnov, sedih bgt padahal lagi ngidam",di kediri point coffee nya tutup gegara idm nya direnov sedih bgt padahal lagi ngidam,di kediri point coffee nya tutup gegara idm nya direnov sedih banget padahal lagi ngidam
09/2023,"Duh kepikiran mau order point coffee, tapi udh aman belom yak minum es (:",duh kepikiran mau order point coffee tapi udh aman belom yak minum es ,aduh terpikirkan mau order point coffee tapi sudah aman belum yak minum es
09/2023,"Nder, kamu bikin aku pengen order point coffee Tapi aku masih harus tunggu gajian sampe tgl 5",nder kamu bikin aku pengen order point coffee tapi aku masih harus tunggu gajian sampe tgl ,nder kamu bikin aku pengen order point coffee tapi aku masih harus tunggu gajian sampai tanggal
09/2023,"OIYA BESOK SENIN pengen nyobain point coffee pas promo tapi lupa terus, thanks sender wkwk",oiya besok senin pengen nyobain point coffee pas promo tapi lupa terus thanks sender wkwk,oiya besok senin pengen nyobain point coffee pas promo tapi lupa terus terima kasih sender wkwk
09/2023,"Sama kayak indomaret point, jualan popmie tapi ga ada air panas. Minta ke point coffee juga ga boleh. Akhirnya pesen americano panas ga pake gula dan kopi buat nyeduh popmie",sama kayak indomaret point jualan popmie tapi ga ada air panas minta ke point coffee juga ga boleh akhirnya pesen americano panas ga pake gula dan kopi buat nyeduh popmie,sama kayak indomaret point jualan popmie tapi tidak ada air panas minta ke point coffee juga tidak boleh akhirnya pesen americano panas tidak pakai gula dan kopi buat nyeduh popmie
09/2023,PENGEN BELI tapi yang ada point coffee nya lagi renov jadinya tutup(â ä¸ªâ _â ä¸ªâ ),pengen beli tapi yang ada point coffee nya lagi renov jadinya tutup    ,pengen beli tapi yang ada point coffee nya lagi renovasi jadinya tutup
09/2023,bukan fore asli wuakaka matcha latte bikin sendiri gelasnya bekas fore biar oke xixi + foto di kebon,bukan fore asli wuakaka matcha latte bikin sendiri gelasnya bekas fore biar oke xixi  foto di kebon,bukan fore asli wuakaka matcha latte bikin sendiri gelasnya bekas fore biar oke xixi foto di kebon
09/2023,Cup coffee sing koyok ngene selain fore ndi neh yaa Aku di kei info mbok an,cup coffee sing koyok ngene selain fore ndi neh yaa aku di kei info mbok an,cup coffee sing koyok ngene selain fore ndi neh yaa aku di kei informasi mbok an
09/2023,Samaa tomoro,samaa tomoro,samaa tomoro
09/2023,rating tomoro coffe menurut kalian brpa ?,rating tomoro coffe menurut kalian brpa ,rating tomoro coffe menurut kalian brpa
09/2023,"Kebetulan sm nih, di tomoro",kebetulan sm nih di tomoro,kebetulan sama ini di tomoro
