Date,Text,Normalized_Text_NLTK,Normalized_Text_Slang
12/2023,"Aku tim beli point coffee setiap hari Senin sih, soalnya ada promo ditambah bawa Tumbler sendiri auto hemat..",aku tim beli point coffee setiap hari senin sih soalnya ada promo ditambah bawa tumbler sendiri auto hemat,aku tim beli point coffee setiap hari senin sih soalnya ada promo ditambah bawa tumbler sendiri auto hemat
12/2023,Kopi kenangan tercintaaaaa,kopi kenangan tercintaaaaa,kopi kenangan tercintaaaaa
12/2023,Kopi kenangan mantan nya kopken,kopi kenangan mantan nya kopken,kopi kenangan mantan nya kopi kenangan
12/2023,Kopi kenangan mantan pake outside + less sugar,kopi kenangan mantan pake outside  less sugar,kopi kenangan mantan pakai outside kurang gula
12/2023,"kopi kenangan tp yg di my, beda bgt rasa creamy lemaknya",kopi kenangan tp yg di my beda bgt rasa creamy lemaknya,kopi kenangan tapi yang di my beda banget rasa creamy lemaknya
12/2023,butterscotch sea saltnya fore dan kopi jadoelnya point coffe Indomaret wkwkwk,butterscotch sea saltnya fore dan kopi jadoelnya point coffe indomaret wkwkwk,butterscotch sea saltnya fore dan kopi jadoelnya point coffe indomaret wkwkwk
12/2023,kopi aren nya fore,kopi aren nya fore,kopi aren nya fore
12/2023,Semua rasa di point coffee pokoknya lebih enak dari starbucks!!!,semua rasa di point coffee pokoknya lebih enak dari starbucks,semua rasa di point coffee pokoknya lebih enak dari starbucks
12/2023,"Fore, tuku, point cafe",fore tuku point cafe,fore tuku point cafe
12/2023,"Palm sugar latte point coffee emg enak bgt, tapi aku lebih suka yg varian frappenya",palm sugar latte point coffee emg enak bgt tapi aku lebih suka yg varian frappenya,palm gula latte point coffee memang enak banget tapi aku lebih suka yang varian frappenya
12/2023,"Latte no sugar, Point coffee. Atau kadang ganti susunya pake oatmilk. Beuhhhhhh",latte no sugar point coffee atau kadang ganti susunya pake oatmilk beuhhhhhh,latte no gula point coffee atau kadang ganti susunya pakai oatmilk beuhhhhhh
12/2023,Kopi Kenangan Mantan with Juwara Beans-Kopi Kenangan,kopi kenangan mantan with juwara beanskopi kenangan,kopi kenangan mantan with juwara beanskopi kenangan
12/2023,Lagi suka buttercream lattenya fore sama espresso caramelnya point,lagi suka buttercream lattenya fore sama espresso caramelnya point,lagi suka buttercream lattenya fore sama espresso caramelnya point
12/2023,sejauh ini butterscotch-nya fore,sejauh ini butterscotchnya fore,sejauh ini butterscotchnya fore
12/2023,Menu perkopiannya point coffee Kopi jadoel beanspot alfa,menu perkopiannya point coffee kopi jadoel beanspot alfa,menu perkopiannya point coffee kopi jadoel beanspot alfa
12/2023,"Semua kopi dari space roastery Java punya couvee (kopi yg lain juga enak si, tp fav dari dulu java) Butterscotch seasalt latte punya fore",semua kopi dari space roastery java punya couvee kopi yg lain juga enak si tp fav dari dulu java butterscotch seasalt latte punya fore,semua kopi dari space roastery java punya couvee kopi yang lain juga enak si tapi favorit dari dulu java butterscotch seasalt latte punya fore
12/2023,fore yg butterscoth sea salt latte,fore yg butterscoth sea salt latte,fore yang butterscoth sea salt latte
12/2023,"Dulu sih dulu, starbucks emg enak dan aman bangt buat pasien gerd kaya aku. Tp nyatanya banyak alternatif lain yg lebih enak juga dan aman di lambung kaya harlen holden, filosofi kopi, fore. Tp harus dengan note less coffee atau 1/2 shot",dulu sih dulu starbucks emg enak dan aman bangt buat pasien gerd kaya aku tp nyatanya banyak alternatif lain yg lebih enak juga dan aman di lambung kaya harlen holden filosofi kopi fore tp harus dengan note less coffee atau  shot,dulu sih dulu starbucks memang enak dan aman bangt buat pasien gerd kaya aku tapi nyatanya banyak alternatif lain yang lebih enak juga dan aman di lambung kaya harlen holden filosofi kopi fore tapi harus dengan note kurang coffee atau shot
12/2023,"Aku akan tetap memilih kopi kenangan trus disesuaikan sma selera aku, walaupun sering dibilang kopi aku aneh atau kopi yg gabisa diminum",aku akan tetap memilih kopi kenangan trus disesuaikan sma selera aku walaupun sering dibilang kopi aku aneh atau kopi yg gabisa diminum,aku akan tetap memilih kopi kenangan terus disesuaikan sama selera aku walaupun sering dibilang kopi aku aneh atau kopi yang gabisa diminum
12/2023,"pandan latte janji jiwa, car machiatto point coffee, dua ini udah plg top",pandan latte janji jiwa car machiatto point coffee dua ini udah plg top,pandan latte janji jiwa car machiatto point coffee dua ini sudah paling top
12/2023,Point coffee emg enak sih cuma kalo buat daily ahak tekor,point coffee emg enak sih cuma kalo buat daily ahak tekor,point coffee memang enak sih cuma kalau buat daily ahak rugi
12/2023,"Berry Manuka nya Fore, enak banget",berry manuka nya fore enak banget,berry manuka nya fore enak banget
12/2023,Fore Butterscotch Latte itu enaaaak banget. Terus kalau yang lokalnya di Jakarta tentu saja ada Tuku dengan Kopi Tetangga-nya. Di Bandung ada Kopi Cantel dan Fokasu (menurutku enak).,fore butterscotch latte itu enaaaak banget terus kalau yang lokalnya di jakarta tentu saja ada tuku dengan kopi tetangganya di bandung ada kopi cantel dan fokasu menurutku enak,fore butterscotch latte itu enaaaak banget terus kalau yang lokalnya di jakarta tentu saja ada tuku dengan kopi tetangganya di bandung ada kopi cantel dan fokasu menurutku enak
12/2023,"Maaf banget, point coffee di aku B aja. Better Kopi Re",maaf banget point coffee di aku b aja better kopi re,maaf banget point coffee di aku b saja better kopi reply
12/2023,Iced palm sugar nya point coffee sama es kopi daong sih sejauh ini,iced palm sugar nya point coffee sama es kopi daong sih sejauh ini,iced palm gula nya point coffee sama es kopi daong sih sejauh ini
12/2023,"Point coffee matcha espresso double shot less sugar sama kopken kenangan mantan less atau slight sugar, kopi pandannya xxi",point coffee matcha espresso double shot less sugar sama kopken kenangan mantan less atau slight sugar kopi pandannya xxi,point coffee matcha espresso double shot kurang gula sama kopi kenangan kenangan mantan kurang atau slight gula kopi pandannya xxi
12/2023,CM nya fore,cm nya fore,cm nya fore
12/2023,"arahbica-nya arah coffee, kopi siap salah-nya nu sae, kopsus gula aren kopken, sama americano manukanya fore dah paling best",arahbicanya arah coffee kopi siap salahnya nu sae kopsus gula aren kopken sama americano manukanya fore dah paling best,arahbicanya arah coffee kopi siap salahnya nu sae kopsus gula aren kopi kenangan sama americano manukanya fore deh paling best
12/2023,kopi jadul point coffee,kopi jadul point coffee,kopi jaman dulu point coffee
12/2023,Dolce-nya point coffee enak bgt,dolcenya point coffee enak bgt,dolcenya point coffee enak banget
12/2023,"coklaghtt, matchanya masi dimenangin sama tomoro",coklaghtt matchanya masi dimenangin sama tomoro,coklaghtt matchanya masi dimenangin sama tomoro
12/2023,matcha! kalo coklat aku prefer coklatnya point coffee sih itu definisi coklatku bangetttt wkwkwk,matcha kalo coklat aku prefer coklatnya point coffee sih itu definisi coklatku bangetttt wkwkwk,matcha kalau coklat aku prefer coklatnya point coffee sih itu definisi coklatku bangetttt wkwkwk
12/2023,caramel macchiato kopi kenangan fav gue,caramel macchiato kopi kenangan fav gue,caramel macchiato kopi kenangan favorit aku
12/2023,"milih matcha sih, masih ada pait2nya. tpi kalo ke tempat kopi always beli kopi hehe. btw matcha nya tomoro enakk",milih matcha sih masih ada paitnya tpi kalo ke tempat kopi always beli kopi hehe btw matcha nya tomoro enakk,milih matcha sih masih ada paitnya tapi kalau ke tempat kopi always beli kopi he ngomong-ngomong matcha nya tomoro enakk
12/2023,Kopi kenangan jg enk kemaren beli starbak tp gk seenak kopi kenangan kopi http://j.co jg enak nder yg frapecino,kopi kenangan jg enk kemaren beli starbak tp gk seenak kopi kenangan kopi  jg enak nder yg frapecino,kopi kenangan juga enk kemarin beli starbak tapi gk seenak kopi kenangan kopi juga enak nder yang frapecino
12/2023,minum fore yg pandan latte langsung gliyengan,minum fore yg pandan latte langsung gliyengan,minum fore yang pandan latte langsung gliyengan
12/2023,"fore baru buka di kota ku, enaaaa bgt plis pen kesana trs wkwk",fore baru buka di kota ku enaaaa bgt plis pen kesana trs wkwk,fore baru buka di kota ku enaaaa banget plis pen kesana terus wkwk
12/2023,aku pengen nyoba fore coffee tapi dom banyuwangi belum ada. ayo dong buka cabang di sini walao masih kabupaten tolong di lirik huhu,aku pengen nyoba fore coffee tapi dom banyuwangi belum ada ayo dong buka cabang di sini walao masih kabupaten tolong di lirik huhu,aku pengen nyoba fore coffee tapi dom banyuwangi belum ada ayo dong buka cabang di sini walao masih kabupaten tolong di lirik huhu
12/2023,my one and only matcha latte nya kopi kenangan,my one and only matcha latte nya kopi kenangan,my one and only matcha latte nya kopi kenangan
12/2023,Ngabisin voucher tomoro,ngabisin voucher tomoro,ngabisin voucher tomoro
01/2024,"KALO MAUU BELI TOMORO DOWNLOAD APLIKASI NYA DEH NTAR DISC CUMA JADI 9k aja, btw yg gula aren enak",kalo mauu beli tomoro download aplikasi nya deh ntar disc cuma jadi k aja btw yg gula aren enak,kalau mauu beli tomoro download aplikasi nya deh nanti diskon cuma jadi ke saja ngomong-ngomong yang gula aren enak
01/2024,Favku kopi kenangan mantan,favku kopi kenangan mantan,favku kopi kenangan mantan
01/2024,fav kopi kenangan mantan,fav kopi kenangan mantan,favorit kopi kenangan mantan
01/2024,aku jatuh cinta sm croissantnnya tomoro,aku jatuh cinta sm croissantnnya tomoro,aku jatuh cinta sama croissantnnya tomoro
01/2024,"Kalo yg cup di taruk etalase gitu pernah lewat tiktok di Indomaret yummy choice, tp jg keknya ga banyakk yg begitu. Dulu pernah tanya, kalo mau bisa beli es batu aja lewat point coffee nya",kalo yg cup di taruk etalase gitu pernah lewat tiktok di indomaret yummy choice tp jg keknya ga banyakk yg begitu dulu pernah tanya kalo mau bisa beli es batu aja lewat point coffee nya,kalau yang cup di taruk etalase gitu pernah lewat tiktok di indomaret yummy choice tapi juga kayaknya tidak banyakk yang begitu dulu pernah tanya kalau mau bisa beli es batu saja lewat point coffee nya
01/2024,"aku lupa namanya, pokoknya menu chocolate-nya tomoro itu enak",aku lupa namanya pokoknya menu chocolatenya tomoro itu enak,aku lupa namanya pokoknya menu chocolatenya tomoro itu enak
01/2024,bbq smoke beeff zama jelata cheesee btw ini info promo 9k all menu tomoro coffe pake kode reff guyss,bbq smoke beeff zama jelata cheesee btw ini info promo k all menu tomoro coffe pake kode reff guyss,bbq smoke beeff zama jelata cheesee ngomong-ngomong ini informasi promo ke all menu tomoro coffe pakai kode reff guyss
01/2024,Iseng beli Tomoro Coffee kmrn ngantuk bgt di kantor hari pertama kerja stlh libur krn lagi rame juga dimana mana tp tetep ena Fore ini juga enak sih tp biasa aja kpn2 beli variant matchanya deh,iseng beli tomoro coffee kmrn ngantuk bgt di kantor hari pertama kerja stlh libur krn lagi rame juga dimana mana tp tetep ena fore ini juga enak sih tp biasa aja kpn beli variant matchanya deh,iseng beli tomoro coffee kemarin ngantuk banget di kantor hari pertama kerja setelah libur karena lagi ramai juga dimana mana tapi tetep ena fore ini juga enak sih tapi biasa saja kapan beli variant matchanya deh
01/2024,"IH kayak enak mau, ah males ke tomoro lah mau ambil promo 9k",ih kayak enak mau ah males ke tomoro lah mau ambil promo k,ih kayak enak mau ah males ke tomoro lah mau ambil promo ke
01/2024,kopi kenangan mantan for lyfeeeeeeee,kopi kenangan mantan for lyfeeeeeeee,kopi kenangan mantan for lyfeeeeeeee
01/2024,"iya kaan enak bgttt, jagoanku kalo beli point coffee ya ini. selalu aku rekomendasiin ke semua orang juga wkwkwk",iya kaan enak bgttt jagoanku kalo beli point coffee ya ini selalu aku rekomendasiin ke semua orang juga wkwkwk,iya kaan enak bgttt jagoanku kalau beli point coffee iya ini selalu aku rekomendasiin ke semua orang juga wkwkwk
01/2024,Di point coffee bisa request menu atau nggak sih sebenernya? Siapapun yg tau tolong bantu jawab,di point coffee bisa request menu atau nggak sih sebenernya siapapun yg tau tolong bantu jawab,di point coffee bisa request menu atau tidak sih sebenernya siapapun yang tahu tolong bantu jawab
01/2024,enakk banget kayaknyaa. pan kapan pengen cobain point coffee jugaaa,enakk banget kayaknyaa pan kapan pengen cobain point coffee jugaaa,enakk banget kayaknyaa pan kapan pengen cobain point coffee jugaaa
01/2024,Klo ga suka matcha kira2 apa yg rekomen di point coffee,klo ga suka matcha kira apa yg rekomen di point coffee,kalau tidak suka matcha kira apa yang rekomen di point coffee
01/2024,2 best buy akuuh. Tapi kalo point coffee minta less espresso krn lambung ini tidak kuat wkakak, best buy akuuh tapi kalo point coffee minta less espresso krn lambung ini tidak kuat wkakak,best buy akuuh tapi kalau point coffee minta kurang espresso karena lambung ini tidak kuat wkakak
01/2024,"asli, makanya tiap ke tomoro selalu pesen tomoro oat lattenya",asli makanya tiap ke tomoro selalu pesen tomoro oat lattenya,asli makanya tiap ke tomoro selalu pesen tomoro oat lattenya
01/2024,Aku sih langganan tomoro,aku sih langganan tomoro,aku sih langganan tomoro
01/2024,good day sama kopi kenangan,good day sama kopi kenangan,good day sama kopi kenangan
01/2024,good day sama kopi kenangan sii,good day sama kopi kenangan sii,good day sama kopi kenangan sii
01/2024,"lawson sama tomoro, tapi kalau tomoro lebih suka yg oat",lawson sama tomoro tapi kalau tomoro lebih suka yg oat,lawson sama tomoro tapi kalau tomoro lebih suka yang oat
01/2024,"Kopiko 78Â° , Golda, kopi kenangan reviewnya Tasyi sih nomer uno tapi belum nyoba",kopiko   golda kopi kenangan reviewnya tasyi sih nomer uno tapi belum nyoba,kopiko golda kopi kenangan reviewnya tasyi sih nomer uno tapi belum nyoba
01/2024,"gila, kopi kenangan ungu, baru white coffe",gila kopi kenangan ungu baru white coffe,gila kopi kenangan ungu baru white coffe
01/2024,Kopi kenangan ungu menang telak sih.,kopi kenangan ungu menang telak sih,kopi kenangan ungu menang telak sih
01/2024,"Kopi kenangan, 78",kopi kenangan ,kopi kenangan
01/2024,Lagi kepo bentukannya boba kopi kenangan wkwk,lagi kepo bentukannya boba kopi kenangan wkwk,lagi mau tahu urusan orang bentukannya boba kopi kenangan wkwk
01/2024,"Lagi nyoba point coffee yg palm sugar, terlalu manis palm sugarnya kebanyakan",lagi nyoba point coffee yg palm sugar terlalu manis palm sugarnya kebanyakan,lagi nyoba point coffee yang palm gula terlalu manis palm sugarnya kebanyakan
01/2024,enakan janjiw atau tomoro?,enakan janjiw atau tomoro,enakan janjiw atau tomoro
01/2024,Enakan kopken / tomoro wkwk janjiw kurang berasa matchanya malah kek kebanyakan susu menurutku,enakan kopken  tomoro wkwk janjiw kurang berasa matchanya malah kek kebanyakan susu menurutku,enakan kopi kenangan tomoro wkwk janjiw kurang berasa matchanya bahkan seperti kebanyakan susu menurutku
01/2024,"Luwak white kopi, good day, kopi kenangan",luwak white kopi good day kopi kenangan,luwak white kopi good day kopi kenangan
01/2024,jajan sari roti dan dolce hot point coffee,jajan sari roti dan dolce hot point coffee,jajan sari roti dan dolce hot point coffee
01/2024,Kopi saku point coffee lahh,kopi saku point coffee lahh,kopi saku point coffee lahh
01/2024,Cake choco sama kopii point coffee,cake choco sama kopii point coffee,cake choco sama kopii point coffee
01/2024,kopi kenangan matancino,kopi kenangan matancino,kopi kenangan matancino
01/2024,hambar malah enakan point coffee,hambar malah enakan point coffee,hambar bahkan enakan point coffee
01/2024,KOPI BAPER / KOPI SAKU POINT COFFEE,kopi baper  kopi saku point coffee,kopi baper kopi saku point coffee
01/2024,kopi kenangan gada kh,kopi kenangan gada kh,kopi kenangan gada kh
01/2024,Kopi kenangan gula aren sih tetep,kopi kenangan gula aren sih tetep,kopi kenangan gula aren sih tetep
01/2024,"Ih nauuu, tp jarang ke kopi kenangan, terakhir ke sana taun lalu",ih nauuu tp jarang ke kopi kenangan terakhir ke sana taun lalu,ih nauuu tapi jarang ke kopi kenangan terakhir ke sana tahun lalu
01/2024,"Maaf oot, kalo ada yg mau ke tomoro mau pake voc 9ribu dm aku ya",maaf oot kalo ada yg mau ke tomoro mau pake voc ribu dm aku ya,maaf out of topic kalau ada yang mau ke tomoro mau pakai voc ribu dm aku iya
01/2024,Enak keknya di celupin ke kopi kenangan mantan cocok nih,enak keknya di celupin ke kopi kenangan mantan cocok nih,enak kayaknya di celupin ke kopi kenangan mantan cocok ini
01/2024,Bean spot dr kopi sama rerotiannya emg kalah banget sama saybread/point coffee.,bean spot dr kopi sama rerotiannya emg kalah banget sama saybreadpoint coffee,bean spot dr kopi sama rerotiannya memang kalah banget sama saybreadpoint coffee
01/2024,Kopi kenangan/janji jiwa,kopi kenanganjanji jiwa,kopi kenanganjanji jiwa
01/2024,"Fore, Point, Tomoro, D'journal. Banyak sih Nder.",fore point tomoro djournal banyak sih nder,fore point tomoro djournal banyak sih nder
01/2024,"banyakk. fore, kopken, point, tomoro, tuku",banyakk fore kopken point tomoro tuku,banyakk fore kopi kenangan point tomoro tuku
01/2024,"Fore, Point Coffee, Jco. Coba kedai kopi lokal daerahmu barangkali enak juga.. klo di bdg bisa ke Missbee Providore, Fullmoon, Garmelia, Kopi Teko (Jatinangor)",fore point coffee jco coba kedai kopi lokal daerahmu barangkali enak juga klo di bdg bisa ke missbee providore fullmoon garmelia kopi teko jatinangor,fore point coffee jco coba kedai kopi lokal daerahmu barangkali enak juga kalau di bandung bisa ke missbee providore fullmoon garmelia kopi teko jatinangor
01/2024,"Fore, flash, kopken, tomoro, tuku (kqtanya enak bgt tp aku blm coba) ayokk nder masi banyak ko",fore flash kopken tomoro tuku kqtanya enak bgt tp aku blm coba ayokk nder masi banyak ko,fore flash kopi kenangan tomoro tuku kqtanya enak banget tapi aku belum coba ayokk nder masi banyak ko
01/2024,fore sama kopi kenangan sih jagoan,fore sama kopi kenangan sih jagoan,fore sama kopi kenangan sih jagoan
01/2024,"Kalo aku sih point, janji jiwa, belikopi, kopi kenangan. Kalo americano suka di janji jiwa sama point.",kalo aku sih point janji jiwa belikopi kopi kenangan kalo americano suka di janji jiwa sama point,kalau aku sih point janji jiwa belikopi kopi kenangan kalau americano suka di janji jiwa sama point
01/2024,"banyak nder, ada point, fore, tuku, kopken, tomoro",banyak nder ada point fore tuku kopken tomoro,banyak nder ada point fore tuku kopi kenangan tomoro
01/2024,"Kamu nyari kopi apa tempat nongkrongnya nder? Kalau nyari kopi sih mestinya banyak banget yang lebih enak, Fore sama point coffee sih kalau aku.",kamu nyari kopi apa tempat nongkrongnya nder kalau nyari kopi sih mestinya banyak banget yang lebih enak fore sama point coffee sih kalau aku,kamu mencari kopi apa tempat nongkrongnya nder kalau mencari kopi sih mestinya banyak banget yang lebih enak fore sama point coffee sih kalau aku
01/2024,Aku sih point coffee,aku sih point coffee,aku sih point coffee
01/2024,"kenangan, forw, flash, tomoro.",kenangan forw flash tomoro,kenangan forw flash tomoro
01/2024,"Fore. Cobain deeh dia enak juga kok, banyak promo juga dari appsnya. Harganya juga ga jauh beda lah sama b*x Terus tomoro juga enak. Aduuuh kamu dom mana sih nder? Kalo malang aku siap memberi rekomendasi kopi enak di malang :((((",fore cobain deeh dia enak juga kok banyak promo juga dari appsnya harganya juga ga jauh beda lah sama bx terus tomoro juga enak aduuuh kamu dom mana sih nder kalo malang aku siap memberi rekomendasi kopi enak di malang ,fore cobain deeh dia enak juga kok banyak promo juga dari appsnya harganya juga tidak jauh beda lah sama bx terus tomoro juga enak aduuuh kamu dom mana sih nder kalau malang aku siap memberi rekomendasi kopi enak di malang
01/2024,"""Kopi Kenangan"" , "" Kopi Tuku"" Good Day vanilla latte, Kapal Api",kopi kenangan   kopi tuku good day vanilla latte kapal api,kopi kenangan kopi tuku good day vanilla latte kapal api
01/2024,"fore, kopken, tuku, point coffee ini sih yg biasa gue minum",fore kopken tuku point coffee ini sih yg biasa gue minum,fore kopi kenangan tuku point coffee ini sih yang biasa aku minum
01/2024,Fore kalo ga tomoro,fore kalo ga tomoro,fore kalau tidak tomoro
01/2024,"Domisili mana? Kalo di jogja ga kurang2, sampe gpp bgt ga ke sbx Couvee, cosan, pitutur, klinik kopi, satu lokasi, tekoff (kopi lebih beneran enak, harga lebih terjangkau) Yang banyak cabang: Tomoro, fore",domisili mana kalo di jogja ga kurang sampe gpp bgt ga ke sbx couvee cosan pitutur klinik kopi satu lokasi tekoff kopi lebih beneran enak harga lebih terjangkau yang banyak cabang tomoro fore,domisili mana kalau di jogja tidak kurang sampai tidak apa-apa banget tidak ke sbx couvee cosan pitutur klinik kopi satu lokasi tekoff kopi lebih beneran enak harga lebih terjangkau yang banyak cabang tomoro fore
01/2024,"Aku sering belinya kopken, kopinya roti O, tomoro & lawson karena yg deket tempat kerja itu. Tapi fore & point juga enak nder",aku sering belinya kopken kopinya roti o tomoro  lawson karena yg deket tempat kerja itu tapi fore  point juga enak nder,aku sering belinya kopi kenangan kopinya roti o tomoro lawson karena yang deket tempat kerja itu tapi fore point juga enak nder
01/2024,"Fore, tomoro, tuku",fore tomoro tuku,fore tomoro tuku
01/2024,"- Kopken (krn aku gakuat sm kopinya kopken, biasanya ak pesen matchalatte dan ini enak bgt) - kopinya roti O (kopinya enak, ga bikin perut kembung, biasanya aku pesen kopi regal) - point coffee (blm pernah nyobain apapun selain matcha lattenya) - pesenkopi - kopstud 24", kopken krn aku gakuat sm kopinya kopken biasanya ak pesen matchalatte dan ini enak bgt  kopinya roti o kopinya enak ga bikin perut kembung biasanya aku pesen kopi regal  point coffee blm pernah nyobain apapun selain matcha lattenya  pesenkopi  kopstud ,kopi kenangan karena aku gakuat sama kopinya kopi kenangan biasanya saya pesen matchalatte dan ini enak banget kopinya roti o kopinya enak tidak bikin perut kembung biasanya aku pesen kopi regal point coffee belum pernah nyobain apapun selain matcha lattenya pesenkopi kopstud
01/2024,"banyakkk. kalo cari kopi menurutku tuku, fore, sama calf. calf ini kayaknya masih banyak yang belum tauu, tapi enak bangett kopinya menurutku. kalo nyari matcha, tomoro enakk!! dia tipe matcha yang pahittt",banyakkk kalo cari kopi menurutku tuku fore sama calf calf ini kayaknya masih banyak yang belum tauu tapi enak bangett kopinya menurutku kalo nyari matcha tomoro enakk dia tipe matcha yang pahittt,banyakkk kalau cari kopi menurutku tuku fore sama calf calf ini kayaknya masih banyak yang belum tauu tapi enak bangett kopinya menurutku kalau mencari matcha tomoro enakk dia tipe matcha yang pahittt
01/2024,"Cafe lokal di sekitar mu bisa jadi opsi nder. Fore sama Point coffee juga enak. Kalau mau bikin sendiri lebih hemat, bisa di atur sesuka kita. Kopi bubuk nya coba waringkas. Krimer, gula aren juga banyak dijual dipasaran, susu nya pake oatside aja atau pilih yg fresh milk",cafe lokal di sekitar mu bisa jadi opsi nder fore sama point coffee juga enak kalau mau bikin sendiri lebih hemat bisa di atur sesuka kita kopi bubuk nya coba waringkas krimer gula aren juga banyak dijual dipasaran susu nya pake oatside aja atau pilih yg fresh milk,cafe lokal di sekitar mu bisa jadi opsi nder fore sama point coffee juga enak kalau mau bikin sendiri lebih hemat bisa di atur sesuka kita kopi bubuk nya coba waringkas krimer gula aren juga banyak dijual dipasaran susu nya pakai oatside saja atau pilih yang fresh milk
01/2024,"aku skrg lagi suka banget ke tomoro! kmren dapet voucher semua variant 9k. harga normal nya juga ga yg mahal bgt, daaaaaaan kopi nya enak bgt!",aku skrg lagi suka banget ke tomoro kmren dapet voucher semua variant k harga normal nya juga ga yg mahal bgt daaaaaaan kopi nya enak bgt,aku sekarang lagi suka banget ke tomoro kmren dapat voucher semua variant ke harga normal nya juga tidak yang mahal banget daaaaaaan kopi nya enak banget
01/2024,"Fore, tuku, kopi kenangan",fore tuku kopi kenangan,fore tuku kopi kenangan
01/2024,"Janji Jiwa, Kopi Kenangan",janji jiwa kopi kenangan,janji jiwa kopi kenangan
01/2024,"flash coffee, tuku, tomoro, fore",flash coffee tuku tomoro fore,flash coffee tuku tomoro fore
01/2024,FORE!!!! Enak bgt salt creamnya sama matchanya jg gak kalah kaya sb. Tomoro jg mantep kopinya,fore enak bgt salt creamnya sama matchanya jg gak kalah kaya sb tomoro jg mantep kopinya,fore enak banget salt creamnya sama matchanya juga gak kalah kaya sb tomoro juga mantap kopinya
01/2024,"Kopi kenangan, Fore",kopi kenangan fore,kopi kenangan fore
01/2024,fore sama point coffee sihh,fore sama point coffee sihh,fore sama point coffee sihh
01/2024,"Fore, kenangan, janji jiwa, jco, tomoro coffee, roti o, cafe lokal di daerah lu",fore kenangan janji jiwa jco tomoro coffee roti o cafe lokal di daerah lu,fore kenangan janji jiwa jco tomoro coffee roti o cafe lokal di daerah kamu
01/2024,"Fore, tomoro, tuku. 3 ini enak kata gw mah dan tergolong udah banyak di mana2. Tempatnya juga banyak yg udah oke",fore tomoro tuku  ini enak kata gw mah dan tergolong udah banyak di mana tempatnya juga banyak yg udah oke,fore tomoro tuku ini enak kata saya mah dan tergolong sudah banyak di mana tempatnya juga banyak yang sudah oke
01/2024,Berdasarkan jam buka tutup point coffee,berdasarkan jam buka tutup point coffee,berdasarkan jam buka tutup point coffee
01/2024,"Ga enakkk dibanding kopi2 yg lain kaya kenangan, tuku menurut aku tomoro paling ga enak cair bgt",ga enakkk dibanding kopi yg lain kaya kenangan tuku menurut aku tomoro paling ga enak cair bgt,tidak enakkk dibanding kopi yang lain kaya kenangan tuku menurut aku tomoro paling tidak enak cair banget
